<?xml version="1.0" encoding="UTF-8"?>
<rlkin xmlns:xsi="http://www.w3.org/2001/XMLSchema-instance" xsi:noNamespaceSchemaLocation="rlkin.xsd">
	<puma>
		<manufacturer>St√§ubli</manufacturer>
		<name>TX-90L</name>
		<world id="world">
			<rotation>
				<x>0</x>
				<y>0</y>
				<z>0</z>
			</rotation>
			<translation>
				<x>0</x>
				<y>0</y>
				<z>0</z>
			</translation>
		</world>
		<transform id="base">
			<frame>
				<a idref="world"/>
				<b idref="link0"/>
			</frame>
			<rotation>
				<x>0</x>
				<y>0</y>
				<z>0</z>
			</rotation>
			<translation>
				<x>0</x>
				<y>0</y>
				<z>0</z>
			</translation>
		</transform>
		<link id="link0">
			<ignore/>
			<ignore idref="link1"/>
		</link>
		<revolute id="joint0">
			<frame>
				<a idref="link0"/>
				<b idref="link1"/>
			</frame>
			<dh>
				<d>0.478</d>
				<theta>0</theta>
				<a>0.05</a>
				<alpha>-90</alpha>
			</dh>
			<max>180</max>
			<min>-180</min>
			<speed>215</speed>
		</revolute>
		<link id="link1">
			<ignore idref="link0"/>
			<ignore idref="link2"/>
		</link>
		<revolute id="joint1">
			<frame>
				<a idref="link1"/>
				<b idref="link2"/>
			</frame>
			<dh>
				<d>0</d>
				<theta>-90</theta>
				<a>0.5</a>
				<alpha>0</alpha>
			</dh>
			<max>147.5</max>
			<min>-130</min>
			<speed>170</speed>
		</revolute>
		<link id="link2">
			<ignore idref="link1"/>
			<ignore idref="link3"/>
			<ignore idref="link4"/>
		</link>
		<revolute id="joint2">
			<frame>
				<a idref="link2"/>
				<b idref="link3"/>
			</frame>
			<dh>
				<d>0.05</d>
				<theta>-90</theta>
				<a>0</a>
				<alpha>-90</alpha>
			</dh>
			<max>145</max>
			<min>-145</min>
			<speed>255</speed>
		</revolute>
		<link id="link3">
			<ignore idref="link2"/>
			<ignore idref="link4"/>
		</link>
		<revolute id="joint3">
			<frame>
				<a idref="link3"/>
				<b idref="link4"/>
			</frame>
			<dh>
				<d>0.55</d>
				<theta>0</theta>
				<a>0</a>
				<alpha>90</alpha>
			</dh>
			<max>270</max>
			<min>-270</min>
			<speed>430</speed>
		</revolute>
		<link id="link4">
			<ignore idref="link2"/>
			<ignore idref="link3"/>
			<ignore idref="link5"/>
			<ignore idref="link6"/>
		</link>
		<revolute id="joint4">
			<frame>
				<a idref="link4"/>
				<b idref="link5"/>
			</frame>
			<dh>
				<d>0</d>
				<theta>180</theta>
				<a>0</a>
				<alpha>90</alpha>
			</dh>
			<max>140</max>
			<min>-115</min>
			<speed>350</speed>
		</revolute>
		<link id="link5">
			<ignore idref="link4"/>
			<ignore idref="link6"/>
		</link>
		<revolute id="joint5">
			<frame>
				<a idref="link5"/>
				<b idref="link6"/>
			</frame>
			<dh>
				<d>0.1</d>
				<theta>0</theta>
				<a>0</a>
				<alpha>0</alpha>
			</dh>
			<max>270</max>
			<min>-270</min>
			<speed>600</speed>
		</revolute>
		<link id="link6">
			<ignore idref="link4"/>
			<ignore idref="link5"/>
		</link>
		<transform id="tool">
			<frame>
				<a idref="link6"/>
				<b idref="tcp"/>
			</frame>
			<rotation>
				<x>0</x>
				<y>0</y>
				<z>0</z>
			</rotation>
			<translation>
				<x>0</x>
				<y>0</y>
				<z>0</z>
			</translation>
		</transform>
		<frame id="tcp"/>
	</puma>
</rlkin>
