<?xml version="1.0" encoding="UTF-8"?>
<rlkin xmlns:xsi="http://www.w3.org/2001/XMLSchema-instance" xsi:noNamespaceSchemaLocation="rlkin.xsd">
	<kinematics>
		<manufacturer></manufacturer>
		<name>Example</name>
		<world id="world">
			<rotation>
				<x>0</x>
				<y>0</y>
				<z>0</z>
			</rotation>
			<translation>
				<x>0</x>
				<y>0</y>
				<z>0</z>
			</translation>
		</world>
		<transform id="base">
			<frame>
				<a idref="world"/>
				<b idref="link0"/>
			</frame>
			<rotation>
				<x>0</x>
				<y>0</y>
				<z>90</z>
			</rotation>
			<translation>
				<x>0</x>
				<y>0</y>
				<z>0</z>
			</translation>
		</transform>
		<link id="link0">
			<ignore/>
			<ignore idref="link1"/>
			<ignore idref="link2"/>
		</link>
		<revolute id="joint0">
			<frame>
				<a idref="link0"/>
				<b idref="link1"/>
			</frame>
			<dh>
				<d>0.1</d>
				<theta>0</theta>
				<a>0.3</a>
				<alpha>0</alpha>
			</dh>
			<max>180</max>
			<min>-180</min>
		</revolute>
		<link id="link1">
			<ignore idref="link0"/>
			<ignore idref="link2"/>
		</link>
		<revolute id="joint1">
			<frame>
				<a idref="link1"/>
				<b idref="link2"/>
			</frame>
			<dh>
				<d>0.05</d>
				<theta>0</theta>
				<a>0.33</a>
				<alpha>0</alpha>
			</dh>
			<max>180</max>
			<min>-180</min>
		</revolute>
		<link id="link2">
			<ignore idref="link0"/>
			<ignore idref="link1"/>
		</link>
		<transform id="tool">
			<frame>
				<a idref="link2"/>
				<b idref="tcp"/>
			</frame>
			<rotation>
				<x>0</x>
				<y>0</y>
				<z>0</z>
			</rotation>
			<translation>
				<x>0</x>
				<y>0</y>
				<z>-0.025</z>
			</translation>
		</transform>
		<frame id="tcp"/>
	</kinematics>
</rlkin>
